{
  "$schema": "../../../schemas/place.schema.json",
  "country_code": "kr",
  "region_slug": "gangwon",
  "place_slug": "alpensia",
  "name": "Alpensia",
  "region": "Gangwon",
  "country": "South Korea",
  "coordinates": {
    "latitude": 37.656374437920505,
    "longitude": 128.6733956273516
  },
  "elevations": {
    "base_m": 0,
    "summit_m": 0
  },
  "tags": [
    "resort",
    "korea"
  ],
  "name_i18n": {
    "ko": "알펜시아",
    "en": "Alpensia",
    "ja": "アルペンシア"
  },
  "region_i18n": {
    "ko": "강원",
    "en": "Gangwon",
    "ja": "江原"
  },
  "country_i18n": {
    "ko": "대한민국",
    "en": "South Korea",
    "ja": "韓国"
  }
}
