{
  "$schema": "../../../schemas/place.schema.json",
  "country_code": "jp",
  "region_slug": "hokkaido",
  "place_slug": "tomamu",
  "name": "Hoshino Resorts TOMAMU",
  "region": "Hokkaido",
  "country": "Japan",
  "coordinates": {
    "latitude": 43.0795,
    "longitude": 142.6127
  },
  "elevations": {
    "base_m": 586,
    "summit_m": 1171
  },
  "tags": [
    "hokkaido",
    "resort",
    "family",
    "destination"
  ]
}
