{
  "$schema": "../../../schemas/place.schema.json",
  "country_code": "jp",
  "region_slug": "hokkaido",
  "place_slug": "niseko-grand-hirafu",
  "name": "Niseko Grand Hirafu",
  "region": "Hokkaido",
  "country": "Japan",
  "coordinates": {
    "latitude": 42.8646,
    "longitude": 140.7042
  },
  "elevations": {
    "base_m": 300,
    "summit_m": 1200
  },
  "tags": [
    "hokkaido",
    "niseko-united",
    "resort",
    "all-mountain-pass"
  ]
}
