{
  "$schema": "../../../schemas/place.schema.json",
  "country_code": "kr",
  "region_slug": "gangwon",
  "place_slug": "vivaldi-park",
  "name": "Vivaldi Park",
  "region": "Gangwon",
  "country": "South Korea",
  "coordinates": {
    "latitude": 37.64508331765885,
    "longitude": 127.68202103965271
  },
  "elevations": {
    "base_m": 0,
    "summit_m": 0
  },
  "tags": [
    "resort",
    "korea"
  ],
  "name_i18n": {
    "ko": "비발디파크",
    "en": "Vivaldi Park",
    "ja": "ビバルディパーク"
  },
  "region_i18n": {
    "ko": "강원",
    "en": "Gangwon",
    "ja": "江原"
  },
  "country_i18n": {
    "ko": "대한민국",
    "en": "South Korea",
    "ja": "韓国"
  }
}
