{
  "$schema": "../../../schemas/place.schema.json",
  "country_code": "kr",
  "region_slug": "gangwon",
  "place_slug": "elysian-gangchon",
  "name": "Elysian Gangchon",
  "region": "Gangwon",
  "country": "South Korea",
  "coordinates": {
    "latitude": 37.822145126315334,
    "longitude": 127.58991724984118
  },
  "elevations": {
    "base_m": 0,
    "summit_m": 0
  },
  "tags": [
    "resort",
    "korea"
  ],
  "name_i18n": {
    "ko": "엘리시안 강촌",
    "en": "Elysian Gangchon",
    "ja": "エリシアン・ガンチョン"
  },
  "region_i18n": {
    "ko": "강원",
    "en": "Gangwon",
    "ja": "江原"
  },
  "country_i18n": {
    "ko": "대한민국",
    "en": "South Korea",
    "ja": "韓国"
  }
}
