{
  "$schema": "../../../schemas/place.schema.json",
  "country_code": "kr",
  "region_slug": "gangwon",
  "place_slug": "high1",
  "name": "High1",
  "region": "Gangwon",
  "country": "South Korea",
  "coordinates": {
    "latitude": 37.20814465709975,
    "longitude": 128.82597024482814
  },
  "elevations": {
    "base_m": 0,
    "summit_m": 0
  },
  "tags": [
    "resort",
    "korea"
  ],
  "name_i18n": {
    "ko": "하이원",
    "en": "High1",
    "ja": "ハイワン"
  },
  "region_i18n": {
    "ko": "강원",
    "en": "Gangwon",
    "ja": "江原"
  },
  "country_i18n": {
    "ko": "대한민국",
    "en": "South Korea",
    "ja": "韓国"
  }
}
