{
  "$schema": "../../../../schemas/place.schema.json",
  "country_code": "jp",
  "region_slug": "hokkaido",
  "place_slug": "niseko-grand-hirafu",
  "name": "Niseko Grand Hirafu",
  "name_i18n": {
    "en": "Niseko Grand Hirafu",
    "ko": "니세코 그랜드 히라후",
    "ja": "ニセコ東急グラン・ヒラフ"
  },
  "region": "Hokkaido",
  "country": "Japan",
  "coordinates": {
    "latitude": 42.8674,
    "longitude": 140.6834
  },
  "elevations": {
    "base_m": 300,
    "summit_m": 1200
  },
  "tags": [
    "hokkaido",
    "niseko-united",
    "resort",
    "all-mountain-pass"
  ]
}
