{
  "$schema": "../../../schemas/place.schema.json",
  "country_code": "kr",
  "region_slug": "gangwon",
  "place_slug": "oak-valley",
  "name": "Oak Valley",
  "region": "Gangwon",
  "country": "South Korea",
  "coordinates": {
    "latitude": 37.4031964505172,
    "longitude": 127.817056509833
  },
  "elevations": {
    "base_m": 0,
    "summit_m": 0
  },
  "tags": [
    "resort",
    "korea"
  ],
  "name_i18n": {
    "ko": "오크밸리",
    "en": "Oak Valley",
    "ja": "オークバレー"
  },
  "region_i18n": {
    "ko": "강원",
    "en": "Gangwon",
    "ja": "江原"
  },
  "country_i18n": {
    "ko": "대한민국",
    "en": "South Korea",
    "ja": "韓国"
  }
}
