{
  "$schema": "../../../../schemas/place.schema.json",
  "country_code": "kr",
  "region_slug": "gyeongsangnam-do",
  "place_slug": "eden-valley",
  "name": "Eden Valley",
  "region": "Gyeongsangnam-do",
  "country": "South Korea",
  "coordinates": {
    "latitude": 35.4248265727876,
    "longitude": 128.985235423114
  },
  "elevations": {
    "base_m": 0,
    "summit_m": 0
  },
  "tags": [
    "resort",
    "korea"
  ],
  "name_i18n": {
    "ko": "에덴밸리",
    "en": "Eden Valley",
    "ja": "エデンバレー"
  },
  "region_i18n": {
    "ko": "경상남도",
    "en": "Gyeongsangnam-do",
    "ja": "慶尚南道"
  },
  "country_i18n": {
    "ko": "대한민국",
    "en": "South Korea",
    "ja": "韓国"
  }
}
