{
  "$schema": "../../../schemas/place.schema.json",
  "country_code": "jp",
  "region_slug": "hokkaido",
  "place_slug": "furano",
  "name": "Furano Ski Resort",
  "region": "Hokkaido",
  "country": "Japan",
  "coordinates": {
    "latitude": 43.3408,
    "longitude": 142.383
  },
  "elevations": {
    "base_m": 245,
    "summit_m": 1209
  },
  "tags": [
    "hokkaido",
    "resort",
    "city-access",
    "destination"
  ]
}
