{
  "$schema": "../../../../schemas/place.schema.json",
  "country_code": "jp",
  "region_slug": "hokkaido",
  "place_slug": "kiroro",
  "name": "Kiroro Snow World",
  "region": "Hokkaido",
  "country": "Japan",
  "coordinates": {
    "latitude": 43.0679,
    "longitude": 140.9821
  },
  "elevations": {
    "base_m": 520,
    "summit_m": 1180
  },
  "tags": [
    "hokkaido",
    "resort",
    "powder",
    "destination"
  ]
}
