{
  "$schema": "../../../schemas/place.schema.json",
  "country_code": "ch",
  "region_slug": "bernese-oberland",
  "place_slug": "eiger-north-face",
  "name": "Eiger North Face",
  "region": "Bernese Oberland",
  "country": "Switzerland",
  "coordinates": {
    "latitude": 46.5778,
    "longitude": 8.0053
  },
  "elevations": {
    "base_m": 1034,
    "summit_m": 3967
  },
  "tags": [
    "extreme",
    "alpine",
    "glacier"
  ]
}
