{
  "$schema": "../../../../schemas/place.schema.json",
  "country_code": "kr",
  "region_slug": "gangwon",
  "place_slug": "yongpyong",
  "name": "Yongpyong",
  "region": "Gangwon",
  "country": "South Korea",
  "coordinates": {
    "latitude": 37.64575528879609,
    "longitude": 128.6805216545055
  },
  "elevations": {
    "base_m": 0,
    "summit_m": 0
  },
  "tags": [
    "resort",
    "korea"
  ],
  "name_i18n": {
    "ko": "용평",
    "en": "Yongpyong",
    "ja": "ヨンピョン"
  },
  "region_i18n": {
    "ko": "강원",
    "en": "Gangwon",
    "ja": "江原"
  },
  "country_i18n": {
    "ko": "대한민국",
    "en": "South Korea",
    "ja": "韓国"
  },
  "homepage": "https://www.yongpyong.co.kr/kor/skiNboard/introduce.do",
  "air_korea_station": "평창"
}
